{
  "siteId": "a1",
  "siteUrl": "http://a1.localhost:3000",
  "theme": {
    "fonts": {
      "heading": "System Sans",
      "typography": "System Sans"
    },
    "colors": {
      "background": "#FAF7F1",
      "foreground": "#232A28",
      "card": "#FFFFFF",
      "cardForeground": "#232A28",
      "popover": "#FFFFFF",
      "popoverForeground": "#232A28",
      "primary": "#14453D",
      "primaryForeground": "#F7F4EC",
      "secondary": "#E6EDE6",
      "secondaryForeground": "#14453D",
      "muted": "#F1EDE3",
      "mutedForeground": "#5E6A65",
      "accent": "#E6EDE6",
      "accentForeground": "#14453D",
      "destructive": "#B3261E",
      "destructiveForeground": "#FFFFFF",
      "border": "#E2DCD0",
      "input": "#E2DCD0",
      "ring": "#14453D"
    }
  },
  "layout": {
    "header": {
      "id": "site-header",
      "type": "site-header",
      "variant": "default",
      "content": {
        "brandName": "Fern & Grain · Downtown",
        "nav": [
          {
            "label": "Home",
            "target": {
              "kind": "page",
              "pageId": "home"
            }
          },
          {
            "label": "Menu",
            "target": {
              "kind": "page",
              "pageId": "menu"
            }
          },
          {
            "label": "Order Online",
            "target": {
              "kind": "external",
              "href": "https://order.toasttab.com/online/fern-and-grain"
            }
          },
          {
            "label": "Locations",
            "target": {
              "kind": "page",
              "pageId": "home",
              "fragment": "locations"
            }
          },
          {
            "label": "About Us",
            "target": {
              "kind": "page",
              "pageId": "home",
              "fragment": "about"
            }
          },
          {
            "label": "Contact",
            "target": {
              "kind": "page",
              "pageId": "home",
              "fragment": "contact"
            }
          }
        ],
        "orderAction": {
          "label": "Order Now",
          "target": {
            "kind": "external",
            "href": "https://order.toasttab.com/online/fern-and-grain"
          }
        },
        "openMenuLabel": "Open navigation menu",
        "closeMenuLabel": "Close navigation menu",
        "sheetTitle": "Navigation"
      }
    },
    "footer": {
      "id": "site-footer",
      "type": "site-footer",
      "variant": "default",
      "content": {
        "brandName": "Fern & Grain · Downtown",
        "brandDescription": "A fast-casual kitchen for chopped salads, warm grain bowls and cold-pressed drinks, built on produce harvested within 120 miles of Washington, DC.",
        "orderAction": {
          "label": "Order Now",
          "target": {
            "kind": "external",
            "href": "https://order.toasttab.com/online/fern-and-grain"
          }
        },
        "newsletter": {
          "title": "Get the seasonal menu first",
          "description": "One email each season with the dishes we are about to cook — never daily noise.",
          "emailLabel": "Email address",
          "placeholder": "you@example.com",
          "submitLabel": "Subscribe",
          "successMessage": "You are on the list. Our next seasonal menu lands in your inbox.",
          "privacyNote": "At most one email a month. We never share your address."
        },
        "navGroups": [
          {
            "title": "Explore",
            "links": [
              {
                "label": "Home",
                "target": {
                  "kind": "page",
                  "pageId": "home"
                }
              },
              {
                "label": "Menu",
                "target": {
                  "kind": "page",
                  "pageId": "menu"
                }
              },
              {
                "label": "Locations",
                "target": {
                  "kind": "page",
                  "pageId": "home",
                  "fragment": "locations"
                }
              },
              {
                "label": "About Us",
                "target": {
                  "kind": "page",
                  "pageId": "home",
                  "fragment": "about"
                }
              }
            ]
          },
          {
            "title": "Order",
            "links": [
              {
                "label": "Order Online",
                "target": {
                  "kind": "external",
                  "href": "https://order.toasttab.com/online/fern-and-grain"
                }
              },
              {
                "label": "Catering",
                "target": {
                  "kind": "page",
                  "pageId": "home",
                  "fragment": "contact"
                }
              },
              {
                "label": "Pickup & Delivery",
                "target": {
                  "kind": "page",
                  "pageId": "home",
                  "fragment": "locations"
                }
              }
            ]
          }
        ],
        "stores": [
          {
            "name": "Union Market",
            "addressLines": [
              "1309 5th Street NE",
              "Washington, DC 20002"
            ],
            "phone": "(202) 555-0142"
          },
          {
            "name": "Dupont Circle",
            "addressLines": [
              "1527 Connecticut Avenue NW",
              "Washington, DC 20036"
            ],
            "phone": "(202) 555-0188"
          },
          {
            "name": "Bethesda Row",
            "addressLines": [
              "7112 Woodmont Avenue",
              "Bethesda, MD 20814"
            ],
            "phone": "(301) 555-0134"
          }
        ],
        "hoursTitle": "Kitchen hours",
        "hoursLines": [
          "Monday – Thursday · 10:30am – 9:00pm",
          "Friday – Saturday · 10:30am – 10:00pm",
          "Sunday · 11:00am – 8:00pm"
        ],
        "socialTitle": "Follow along",
        "social": [
          {
            "label": "Instagram",
            "href": "https://www.instagram.com/fernandgrain"
          },
          {
            "label": "Facebook",
            "href": "https://www.facebook.com/fernandgrain"
          },
          {
            "label": "TikTok",
            "href": "https://www.tiktok.com/@fernandgrain"
          }
        ],
        "legalLinks": [
          {
            "label": "Privacy Policy",
            "target": {
              "kind": "external",
              "href": "https://www.fernandgrain.com/privacy"
            }
          },
          {
            "label": "Terms of Service",
            "target": {
              "kind": "external",
              "href": "https://www.fernandgrain.com/terms"
            }
          },
          {
            "label": "Accessibility",
            "target": {
              "kind": "external",
              "href": "https://www.fernandgrain.com/accessibility"
            }
          }
        ],
        "copyright": "© 2025 Fern & Grain Kitchens. All rights reserved."
      }
    }
  },
  "pages": [
    {
      "id": "home",
      "path": "/",
      "metadata": {
        "title": "Fern & Grain · Downtown | Fresh Bowls",
        "description": "Fern & Grain is a fast-casual kitchen serving chopped salads, warm grain bowls and cold-pressed drinks made fresh each morning with produce harvested within 120 miles of Washington, DC.",
        "canonicalPath": "/",
        "robots": {
          "index": true,
          "follow": true
        },
        "structuredData": {
          "@context": "https://schema.org",
          "@type": "Restaurant",
          "name": "Fern & Grain",
          "description": "Fast-casual kitchen for chopped salads, warm grain bowls and cold-pressed drinks sourced from farms within 120 miles of Washington, DC.",
          "servesCuisine": [
            "Salads",
            "Grain Bowls",
            "Healthy",
            "Fast Casual"
          ],
          "priceRange": "$$",
          "url": "http://localhost:3000/",
          "telephone": "+1-202-555-0142",
          "address": {
            "@type": "PostalAddress",
            "streetAddress": "1309 5th Street NE",
            "addressLocality": "Washington",
            "addressRegion": "DC",
            "postalCode": "20002",
            "addressCountry": "US"
          },
          "openingHours": [
            "Mo-Th 10:30-21:00",
            "Fr-Sa 10:30-22:00",
            "Su 11:00-20:00"
          ],
          "hasMenu": "http://localhost:3000/menu"
        }
      },
      "sections": [
        {
          "id": "hero",
          "type": "hero",
          "variant": "default",
          "content": {
            "eyebrow": "Seasonal Kitchen · Est. 2014",
            "title": "Fresh bowls in Downtown.",
            "description": "Chef-built salads, warm grain bowls and cold-pressed drinks made fresh every morning with produce harvested within 120 miles of our kitchens.",
            "primaryAction": {
              "label": "Order Now",
              "target": {
                "kind": "external",
                "href": "https://order.toasttab.com/online/fern-and-grain"
              }
            },
            "secondaryAction": {
              "label": "View Menu",
              "target": {
                "kind": "page",
                "pageId": "menu"
              }
            },
            "badges": [
              "Harvested within 120 miles",
              "No seed oils, ever",
              "Compostable packaging"
            ],
            "image": {
              "kind": "image",
              "path": "https://images.unsplash.com/photo-1498837167922-ddd27525d352?auto=format&fit=crop&w=2400&q=80",